{
  "backlinks": {
    "administrator-pell": [],
    "allkept": [
      "artifacts-factions"
    ],
    "anika": [],
    "anya": [
      "kaelen"
    ],
    "captain-serr": [],
    "clara": [],
    "codec": [
      "archive",
      "artifacts-factions",
      "beyond-wall",
      "canon-ledger",
      "chronology",
      "cosmic-architecture",
      "jazen",
      "kail",
      "marcel",
      "marshal-venn",
      "nialbu",
      "ontology-horror",
      "source",
      "starbinding",
      "systems",
      "world"
    ],
    "cradle-exe": [],
    "dao": [
      "archive",
      "beyond-wall",
      "canon-ledger",
      "chronology",
      "codec",
      "kail",
      "marcel",
      "starbinding",
      "systems",
      "trio-gallery"
    ],
    "drk-abyssoriel": [],
    "drk-aerokarst": [],
    "drk-archivore": [],
    "drk-atmantid": [],
    "drk-brinechoir": [],
    "drk-calendarion": [],
    "drk-cinderverge": [
      "artifacts-factions"
    ],
    "drk-cloudmaw": [
      "canon-ledger",
      "chronology"
    ],
    "drk-coronaxis": [],
    "drk-crownmute": [],
    "drk-currenthalo": [],
    "drk-dreamtaxon": [],
    "drk-fault-tongue": [
      "canon-ledger",
      "chronology",
      "media-vault"
    ],
    "drk-feralseed": [],
    "drk-fumericus": [],
    "drk-glacierthroat": [],
    "drk-glassspine": [],
    "drk-gloryfail": [],
    "drk-granithelion": [
      "media-vault"
    ],
    "drk-gridsaint": [],
    "drk-habitarch": [],
    "drk-harborhex": [],
    "drk-helionth": [],
    "drk-hymnlock": [],
    "drk-ironcant": [],
    "drk-lexiclast": [],
    "drk-magma-pleuron": [],
    "drk-memorialvein": [],
    "drk-mycethron": [],
    "drk-nullthorn": [],
    "drk-obsidian-gul": [
      "canon-ledger",
      "chronology",
      "media-vault"
    ],
    "drk-petalnest": [],
    "drk-pollenvault": [
      "media-vault"
    ],
    "drk-quarrymind": [
      "media-vault"
    ],
    "drk-raintaster": [
      "media-vault"
    ],
    "drk-redacted-grin": [],
    "drk-roadthorn": [],
    "drk-shelfcarver": [],
    "drk-shrinehunger": [],
    "drk-singularch": [],
    "drk-skymourn": [],
    "drk-solnexus": [
      "canon-ledger",
      "chronology",
      "drk-coronaxis"
    ],
    "drk-spinal-loop": [],
    "drk-spiremolt": [],
    "drk-terragullet": [
      "canon-ledger",
      "chronology"
    ],
    "drk-the-egg": [],
    "drk-tremorhound": [],
    "drk-umbrakrael": [
      "media-vault"
    ],
    "drk-veilcurrent": [],
    "drk-verdgorge": [],
    "drk-viral-bastion": [],
    "drk-vortenbray": [
      "canon-ledger",
      "chronology"
    ],
    "drk-weathernode": [],
    "eli": [],
    "foldhowl": [
      "cosmic-architecture"
    ],
    "gorevault": [
      "blood-rings",
      "canon-ledger",
      "media-vault",
      "systems"
    ],
    "harold": [
      "clara",
      "jonah",
      "ruth-syrin4"
    ],
    "hesh": [
      "media-vault"
    ],
    "iven": [],
    "jalen": [
      "media-vault",
      "safi"
    ],
    "jazen": [
      "canon-ledger",
      "chronology",
      "codec",
      "marcel",
      "source",
      "starbinding",
      "systems"
    ],
    "jonah": [],
    "jory": [],
    "joss": [],
    "kaelen": [
      "anya"
    ],
    "kail": [
      "archive",
      "beyond-wall",
      "canon-ledger",
      "chronology",
      "codec",
      "kails-mother",
      "marcel",
      "shard-god",
      "starbinding",
      "systems",
      "trio-gallery"
    ],
    "kails-mother": [],
    "khar-venn-child": [],
    "kira": [
      "media-vault"
    ],
    "little-king": [],
    "lyra": [
      "rhys"
    ],
    "lyriboris": [
      "administrator-pell",
      "canon-ledger",
      "captain-serr",
      "chronology",
      "technician-naresh"
    ],
    "mael": [],
    "manifest-discord": [],
    "mara": [
      "mara-syrin4",
      "media-vault",
      "rin"
    ],
    "mara-syrin4": [],
    "marcel": [
      "archive",
      "beyond-wall",
      "canon-ledger",
      "chronology",
      "codec",
      "kail",
      "ontology-horror",
      "starbinding",
      "systems",
      "trio-gallery",
      "wordstreamer"
    ],
    "marn": [],
    "marshal-venn": [
      "source"
    ],
    "mother": [],
    "nialbu": [
      "artifacts-factions",
      "canon-ledger",
      "chronology",
      "codec",
      "cosmic-architecture",
      "ontology-horror",
      "shard-god",
      "starbinding",
      "systems"
    ],
    "nyle-quarth": [],
    "orin": [],
    "reth": [],
    "rhys": [
      "lyra"
    ],
    "rin": [
      "mara",
      "media-vault"
    ],
    "ringthroat": [
      "blood-rings",
      "canon-ledger",
      "media-vault",
      "systems"
    ],
    "ruth-syrin4": [],
    "safi": [
      "jalen",
      "media-vault"
    ],
    "sela-orrin": [],
    "selim": [],
    "sera-inventory": [],
    "shard-god": [],
    "shardlings": [],
    "technician-naresh": [],
    "tomas": [],
    "vessa": [],
    "wordstreamer": [
      "beyond-wall",
      "canon-ledger",
      "chronology",
      "cosmic-architecture",
      "marcel",
      "mother",
      "nialbu",
      "ontology-horror",
      "shard-god",
      "systems"
    ]
  },
  "entities": [
    {
      "id": "administrator-pell",
      "name": "Administrator Pell"
    },
    {
      "id": "allkept",
      "name": "Allkept"
    },
    {
      "id": "anika",
      "name": "Anika"
    },
    {
      "id": "anya",
      "name": "Anya"
    },
    {
      "id": "captain-serr",
      "name": "Captain Serr"
    },
    {
      "id": "clara",
      "name": "Clara"
    },
    {
      "id": "codec",
      "name": "Codec"
    },
    {
      "id": "cradle-exe",
      "name": "Cradle.exe"
    },
    {
      "id": "dao",
      "name": "Dao"
    },
    {
      "id": "drk-abyssoriel",
      "name": "Abyssoriel"
    },
    {
      "id": "drk-aerokarst",
      "name": "Aerokarst"
    },
    {
      "id": "drk-archivore",
      "name": "Archivore"
    },
    {
      "id": "drk-atmantid",
      "name": "Atmantid"
    },
    {
      "id": "drk-brinechoir",
      "name": "Brinechoir"
    },
    {
      "id": "drk-calendarion",
      "name": "Calendarion"
    },
    {
      "id": "drk-cinderverge",
      "name": "Cinderverge"
    },
    {
      "id": "drk-cloudmaw",
      "name": "Cloudmaw"
    },
    {
      "id": "drk-coronaxis",
      "name": "Coronaxis"
    },
    {
      "id": "drk-crownmute",
      "name": "Crownmute"
    },
    {
      "id": "drk-currenthalo",
      "name": "Currenthalo"
    },
    {
      "id": "drk-dreamtaxon",
      "name": "Dreamtaxon"
    },
    {
      "id": "drk-fault-tongue",
      "name": "Fault-Tongue"
    },
    {
      "id": "drk-feralseed",
      "name": "Feralseed"
    },
    {
      "id": "drk-fumericus",
      "name": "Fumericus"
    },
    {
      "id": "drk-glacierthroat",
      "name": "Glacierthroat"
    },
    {
      "id": "drk-glassspine",
      "name": "Glassspine"
    },
    {
      "id": "drk-gloryfail",
      "name": "Gloryfail"
    },
    {
      "id": "drk-granithelion",
      "name": "Granithelion"
    },
    {
      "id": "drk-gridsaint",
      "name": "Gridsaint"
    },
    {
      "id": "drk-habitarch",
      "name": "Habitarch"
    },
    {
      "id": "drk-harborhex",
      "name": "Harborhex"
    },
    {
      "id": "drk-helionth",
      "name": "Helionth"
    },
    {
      "id": "drk-hymnlock",
      "name": "Hymnlock"
    },
    {
      "id": "drk-ironcant",
      "name": "Ironcant"
    },
    {
      "id": "drk-lexiclast",
      "name": "Lexiclast"
    },
    {
      "id": "drk-magma-pleuron",
      "name": "Magma Pleuron"
    },
    {
      "id": "drk-memorialvein",
      "name": "Memorialvein"
    },
    {
      "id": "drk-mycethron",
      "name": "Mycethron"
    },
    {
      "id": "drk-nullthorn",
      "name": "Nullthorn"
    },
    {
      "id": "drk-obsidian-gul",
      "name": "Obsidian Gul"
    },
    {
      "id": "drk-petalnest",
      "name": "Petalnest"
    },
    {
      "id": "drk-pollenvault",
      "name": "Pollenvault"
    },
    {
      "id": "drk-quarrymind",
      "name": "Quarrymind"
    },
    {
      "id": "drk-raintaster",
      "name": "Raintaster"
    },
    {
      "id": "drk-redacted-grin",
      "name": "Redacted Grin"
    },
    {
      "id": "drk-roadthorn",
      "name": "Roadthorn"
    },
    {
      "id": "drk-shelfcarver",
      "name": "Shelfcarver"
    },
    {
      "id": "drk-shrinehunger",
      "name": "Shrinehunger"
    },
    {
      "id": "drk-singularch",
      "name": "Singularch"
    },
    {
      "id": "drk-skymourn",
      "name": "Skymourn"
    },
    {
      "id": "drk-solnexus",
      "name": "Solnexus"
    },
    {
      "id": "drk-spinal-loop",
      "name": "Spinal Loop"
    },
    {
      "id": "drk-spiremolt",
      "name": "Spiremolt"
    },
    {
      "id": "drk-terragullet",
      "name": "Terragullet"
    },
    {
      "id": "drk-the-egg",
      "name": "The Egg"
    },
    {
      "id": "drk-tremorhound",
      "name": "Tremorhound"
    },
    {
      "id": "drk-umbrakrael",
      "name": "Umbrakrael"
    },
    {
      "id": "drk-veilcurrent",
      "name": "Veilcurrent"
    },
    {
      "id": "drk-verdgorge",
      "name": "Verdgorge"
    },
    {
      "id": "drk-viral-bastion",
      "name": "Viral Bastion"
    },
    {
      "id": "drk-vortenbray",
      "name": "Vortenbray"
    },
    {
      "id": "drk-weathernode",
      "name": "Weathernode"
    },
    {
      "id": "eli",
      "name": "Eli"
    },
    {
      "id": "foldhowl",
      "name": "Foldhowl"
    },
    {
      "id": "gorevault",
      "name": "Gorevault"
    },
    {
      "id": "harold",
      "name": "Harold"
    },
    {
      "id": "hesh",
      "name": "Hesh"
    },
    {
      "id": "iven",
      "name": "Iven"
    },
    {
      "id": "jalen",
      "name": "Jalen"
    },
    {
      "id": "jazen",
      "name": "Jazen"
    },
    {
      "id": "jonah",
      "name": "Jonah"
    },
    {
      "id": "jory",
      "name": "Jory"
    },